{
  "fixture_package_kind": "drowned_harbor_state_projection_fixtures",
  "schema_version": 1,
  "prototype_id": "drowned_harbor_dev_only",
  "tale_id": "drowned_harbor",
  "status": "synthetic_test_only_export_excluded",
  "projection_contract_version": 1,
  "fixture_schema": "game/tests/drowned_harbor_dev_only/state_projection_fixture_schema_v1.json",
  "trace_sources": [
    "docs/tales/drowned_harbor/interaction/drowned_harbor_interaction_core_traces_v1.json",
    "docs/tales/drowned_harbor/interaction/drowned_harbor_interaction_resolution_traces_v1.json",
    "docs/tales/drowned_harbor/interaction/drowned_harbor_interaction_continuity_traces_v1.json"
  ],
  "fixtures": [
    {
      "fixture_id": "DH-FIX-001",
      "title": "Low Tide public action projection",
      "trace_id": "DH-IS-003",
      "storyboard_id": "DH-UI-003",
      "fixture_kind": "public_commit_projection",
      "privacy_surface": "public_shared",
      "status": "synthetic_test_only",
      "seed": 3103,
      "source_revision": 11,
      "result_revision": 12,
      "rng_cursor_before": 4,
      "rng_cursor_after": 4,
      "authoritative_commit": true,
      "active_stable_seat_id": "seat_01",
      "authorized_actor_kinds": [
        "active_stable_seat",
        "game_control"
      ],
      "projection_request": {
        "fixture_id": "DH-FIX-001",
        "source_revision": 11,
        "actor_kind": "active_stable_seat",
        "stable_seat_id": "seat_01",
        "intent": "project_low_tide_public_action"
      },
      "source_state": {
        "public": {
          "stage": "low_tide_arrival",
          "tide_state": "extreme_low_tide_returning",
          "objective": "Reach one public landmark and recover a record before the water returns.",
          "routes": {
            "causeway_to_bellhouse": "open",
            "causeway_to_salt_market": "open",
            "mudflat_to_lifeboat_shed": "unstable"
          },
          "resources": {
            "shared_light": 2,
            "public_clues": 1
          },
          "caption": "The Bellhouse route remains open. The lifeboat route is unstable.",
          "history_label": "Low Tide public action",
          "legal_actions": [
            "move_to_bellhouse",
            "inspect_salt_market",
            "stabilize_lifeboat_route"
          ]
        },
        "seat_public": {
          "seat_id": "seat_01",
          "control_source": "human",
          "location": "causeway",
          "public_form": "living",
          "condition": "ready",
          "inventory_count": 1
        },
        "private": {
          "role": "bellmarked_candidate",
          "objective": "PRIVATE_FIND_MISSING_NAME",
          "inventory": [
            "PRIVATE_SALT_KEY"
          ],
          "hidden_route": "archive_culvert"
        },
        "diagnostic_nonplayer": {
          "fixture_revision": "p0.14",
          "authoring_note": "synthetic only"
        }
      },
      "projection_map": {
        "public": {
          "stage": "public.stage",
          "tide_state": "public.tide_state",
          "objective": "public.objective",
          "routes": "public.routes",
          "resources": "public.resources",
          "caption": "public.caption",
          "history_label": "public.history_label",
          "legal_actions": "public.legal_actions",
          "active_seat": "seat_public"
        },
        "private": {}
      },
      "expected_events": [
        {
          "event_key": "low_tide_public_action_committed",
          "classification": "public",
          "exactly_once": true,
          "payload_map": {
            "stage": "public.stage",
            "seat_id": "seat_public.seat_id",
            "location": "seat_public.location",
            "result_revision": "$result_revision"
          }
        }
      ],
      "negative_cases": [
        {
          "case_id": "stale_revision",
          "mutation": {
            "source_revision_delta": -1
          },
          "expected_error": "stale_source_revision"
        },
        {
          "case_id": "unauthorized_actor",
          "mutation": {
            "actor_kind": "spectator"
          },
          "expected_error": "unauthorized_actor"
        },
        {
          "case_id": "wrong_stable_seat",
          "mutation": {
            "stable_seat_id": "seat_99"
          },
          "expected_error": "wrong_stable_seat"
        },
        {
          "case_id": "unknown_intent",
          "mutation": {
            "intent": "unknown_fixture_intent"
          },
          "expected_error": "unauthorized_intent"
        }
      ],
      "stable_seat_identity_before": "seat_01",
      "stable_seat_identity_after": "seat_01",
      "human_validation_required": true,
      "human_evidence_claimed": false,
      "notes": "Synthetic Low Tide projection. No movement reducer, balance value, or production board state is approved."
    },
    {
      "fixture_id": "DH-FIX-002",
      "title": "Bellhouse decision projection",
      "trace_id": "DH-IS-004",
      "storyboard_id": "DH-UI-004",
      "fixture_kind": "public_commit_projection",
      "privacy_surface": "public_shared",
      "status": "synthetic_test_only",
      "seed": 4104,
      "source_revision": 21,
      "result_revision": 22,
      "rng_cursor_before": 7,
      "rng_cursor_after": 7,
      "authoritative_commit": true,
      "active_stable_seat_id": "seat_02",
      "authorized_actor_kinds": [
        "active_stable_seat"
      ],
      "projection_request": {
        "fixture_id": "DH-FIX-002",
        "source_revision": 21,
        "actor_kind": "active_stable_seat",
        "stable_seat_id": "seat_02",
        "intent": "project_bellhouse_decision"
      },
      "source_state": {
        "public": {
          "stage": "bellhouse_ledger",
          "ledger": {
            "visible_names": 5,
            "erased_positions": 2,
            "unresolved_positions": 1
          },
          "ring_state": {
            "visible_count": 5,
            "audible_count": 6,
            "extra_ring_unresolved": true
          },
          "selected_option": "record_missing_position",
          "public_consequence": "One unresolved position is added to the Ledger without identifying a seat.",
          "objective": "Compare the public Ledger with the lighthouse record.",
          "caption": "The Bellhouse records one unresolved position. No seat is identified.",
          "history_label": "Bellhouse decision committed",
          "legal_actions": [
            "continue_to_lighthouse",
            "inspect_ledger",
            "review_public_record"
          ]
        },
        "seat_public": {
          "seat_id": "seat_02",
          "control_source": "human",
          "location": "bellhouse",
          "public_form": "living",
          "condition": "ready"
        },
        "private": {
          "faction": "PRIVATE_BELLMARKED",
          "objective": "PRIVATE_PRESERVE_HARBOR",
          "ledger_mark": "PRIVATE_SIXTH_NAME"
        },
        "diagnostic_nonplayer": {
          "fixture_revision": "p0.14",
          "authoring_note": "synthetic only"
        }
      },
      "projection_map": {
        "public": {
          "stage": "public.stage",
          "ledger": "public.ledger",
          "ring_state": "public.ring_state",
          "selected_option": "public.selected_option",
          "public_consequence": "public.public_consequence",
          "objective": "public.objective",
          "caption": "public.caption",
          "history_label": "public.history_label",
          "legal_actions": "public.legal_actions",
          "active_seat": "seat_public"
        },
        "private": {}
      },
      "expected_events": [
        {
          "event_key": "bellhouse_decision_committed",
          "classification": "public",
          "exactly_once": true,
          "payload_map": {
            "decision": "public.selected_option",
            "unresolved_positions": "public.ledger.unresolved_positions",
            "seat_id": "seat_public.seat_id",
            "result_revision": "$result_revision"
          }
        }
      ],
      "negative_cases": [
        {
          "case_id": "stale_revision",
          "mutation": {
            "source_revision_delta": -1
          },
          "expected_error": "stale_source_revision"
        },
        {
          "case_id": "unauthorized_actor",
          "mutation": {
            "actor_kind": "spectator"
          },
          "expected_error": "unauthorized_actor"
        },
        {
          "case_id": "wrong_stable_seat",
          "mutation": {
            "stable_seat_id": "seat_99"
          },
          "expected_error": "wrong_stable_seat"
        },
        {
          "case_id": "unknown_intent",
          "mutation": {
            "intent": "unknown_fixture_intent"
          },
          "expected_error": "unauthorized_intent"
        }
      ],
      "stable_seat_identity_before": "seat_02",
      "stable_seat_identity_after": "seat_02",
      "human_validation_required": true,
      "human_evidence_claimed": false,
      "notes": "Synthetic Bellhouse projection. The fixture cannot infer Bellmarked identity or hidden causation."
    },
    {
      "fixture_id": "DH-FIX-003",
      "title": "Controlled-private bargain handoff projection",
      "trace_id": "DH-IS-007",
      "storyboard_id": "DH-UI-007",
      "fixture_kind": "controlled_private_commit_projection",
      "privacy_surface": "controlled_private_surface",
      "status": "synthetic_test_only",
      "seed": 5107,
      "source_revision": 31,
      "result_revision": 32,
      "rng_cursor_before": 9,
      "rng_cursor_after": 9,
      "authoritative_commit": true,
      "active_stable_seat_id": "seat_03",
      "authorized_actor_kinds": [
        "active_stable_seat",
        "approved_takeover_controller",
        "returning_reserved_controller"
      ],
      "projection_request": {